Sheet: Anleitung
A1: 1. Füllen Sie nur die gelben Felder aus
A2: 2. Verwenden Sie die rechststehende Skala (Englische Anleitung ausführlicher als Deutsche)
A3: 3. Wählen Sie eine gelbe Zelle aus und Vergleichen Sie das Kriterium aus der anliegende Zeile mit dem Kriterium aus der anliegenden Spalte
A4: 4. Tragen Sie einen Wert aus der Skala in die Zelle ein, welcher Ihren Präferenzen entspricht
A5: 5. Wiederholen Sie die Schritte bis alle gelben Felder ausgefühllt sind
A16: Beispiel:
A18: Item Number | B18: Item Number | C18: 1 | D18: 2 | E18: 3
B19: Item Description | C19: =T(R[1]C[-1]) -> Menge der Apps | D19: =T(R[2]C[-2]) -> Entwicklungsumgebung | E19: =T(R[3]C[-3]) -> Unterstütze Beriebssysteme
A20: 1 | B20: Menge der Apps | C20: 1 | D20: 7 | E20: 8
A21: 2 | B21: Entwicklungsumgebung | C21: =IF(R[-1]C[1]="","",1/R[-1]C[1]) -> 0.14285714285714285 | D21: 1 | E21: 1
A22: 3 | B22: Unterstütze Beriebssysteme | C22: =IF(R[-2]C[2]="","",1/R[-2]C[2]) -> 0.125 | D22: =IF(R[-1]C[1]="","",1/R[-1]C[1]) -> 1 | E22: 1
A23: 5 | B23: Sum | C23: =IF(R[-3]C="","",SUM(R[-3]C:R[-1]C)) -> 1.2678571428571428 | D23: =IF(R[-3]C="","",SUM(R[-3]C:R[-1]C)) -> 9 | E23: =IF(R[-3]C="","",SUM(R[-3]C:R[-1]C)) -> 10
H27: Rating Scale
H30: Rating | I30: Definition
H31: 9 | I31: Row extremely more important
A32: Mobilität einbringen | H32: 8 | I32: Row very strongly to extremely more important
A33: Linsen: größe Durchblicks | H33: 7 | I33: Row very strongly more important
A34: Runtime enviornment | H34: 6 | I34: Row strongly to very strongly more important
A35: Entwicklung | H35: 5 | I35: Row strongly more important
A36: Unterstütze Betriebssystem ??? | H36: 4 | I36: Row moderately to strongly more important
A37: Zwei Punkte menge der apps, jetzt und prognose | H37: 3 | I37: Row moderately more important
H38: 2 | I38: Row equally important to moderately more important
C39: an der Seite subjektive, Objektive | H39: 1 | I39: Row and column equally important
H40: 1/2 | I40: Column equally important to moderately more important
H41: 1/3 | I41: Column moderately more important
C42: Reihenfolge umtauschen erst unterkrtierien, dann Hauptkrtierien | H42: 1/4 | I42: Column moderately to strongly more important
H43: 1/5 | I43: Column strongly more important
H44: 1/6 | I44: Column strongly to very strongly more important
H45: 1/7 | I45: Column very strongly more important
H46: 1/8 | I46: Column very strongly to extremely more important
H47: 1/9 | I47: Column extremely more important

Sheet: Gewichtung Tragekomfort
C1: CR Value = | D1: =R[28]C[5] -> -1.1111111111111112 | F1: =IF(RC[-2]<0.1,"Reasonable Consistency","Not Consistent") -> Reasonable Consistency
C2: Pairwise comparisons
A3: Item Number | C3: Item Number | D3: 1 | E3: 2 | F3: 3 | G3: 4 | K3: ONLY ENTER in the yellow fields
C4: Item Description | D4: Gewicht | E4: Polsterung | F4: Mit Brille nutzbar | G4: =T(R[4]C[-4]) -> subjektives Empfinden | K4: Item Descriptions can be text
A5: 1 | B5: Gewicht der Brille | C5: Gewicht | D5: 1
A6: 2 | B6: Wie bequem ist die Polsterung? | C6: Polsterung | D6: =IF(R[-1]C[1]="","",1/R[-1]C[1]) ->  | E6: 1
A7: 3 | B7: Kann eine Brille unter der VR Brille genutzt werden? | C7: Mit Brille nutzbar | D7: =IF(R[-2]C[2]="","",1/R[-2]C[2]) ->  | E7: =IF(R[-1]C[1]="","",1/R[-1]C[1]) ->  | F7: 1
A8: 4 | C8: subjektives Empfinden | D8: =IF(R[-3]C[3]="","",1/R[-3]C[3]) ->  | E8: =IF(R[-2]C[2]="","",1/R[-2]C[2]) ->  | F8: =IF(R[-1]C[1]="","",1/R[-1]C[1]) ->  | G8: 1
A9: 5 | C9: Sum | D9: =IF(R[-4]C="","",SUM(R[-4]C:R[-1]C)) -> 1 | E9: =IF(R[-4]C="","",SUM(R[-4]C:R[-1]C)) ->  | F9: =IF(R[-4]C="","",SUM(R[-4]C:R[-1]C)) ->  | G9: =IF(R[-4]C="","",SUM(R[-4]C:R[-1]C)) -> 
C11: STANDARDIZED MATRIX
D12: =R[-8]C -> Gewicht | E12: =R[-8]C -> Polsterung | F12: =R[-8]C -> Mit Brille nutzbar | G12: =R[-8]C -> subjektives Empfinden | H12: Weight
A13: 1 | B13: Gewicht der Brille | C13: =IF(R[-8]C="","",R[-8]C) -> Gewicht | D13: =IF(R[-8]C="","",R[-8]C/R9C4) -> 1 | E13: =IF(R[-8]C="","",R[-8]C/R9C) ->  | F13: =IF(R[-8]C="","",R[-8]C6/R9C) ->  | G13: =IF(R[-8]C="","",R[-8]C7/R9C) ->  | H13: =IF(RC[-4]="","",(SUM(RC[-4]:RC[-1])/R26C9)) -> 0.25
A14: 2 | B14: Wie bequem ist die Polsterung? | C14: =IF(R[-8]C="","",R[-8]C) -> Polsterung | D14: =IF(R[-8]C="","",R[-8]C/R9C4) ->  | E14: =IF(R[-9]C="","",R[-8]C/R9C5) ->  | F14: =IF(R[-8]C="","",R[-8]C6/R9C) ->  | G14: =IF(R[-8]C="","",R[-8]C7/R9C) ->  | H14: =IF(RC[-4]="","",(SUM(RC[-4]:RC[-1])/R26C9)) -> 
A15: 3 | B15: Kann eine Brille unter der VR Brille genutzt werden? | C15: =IF(R[-8]C="","",R[-8]C) -> Mit Brille nutzbar | D15: =IF(R[-8]C="","",R[-8]C/R9C4) ->  | E15: =IF(R[-8]C="","",R[-8]C/R9C5) ->  | F15: =IF(R[-10]C="","",R[-8]C6/R9C) ->  | G15: =IF(R[-8]C="","",R[-8]C7/R9C) ->  | H15: =IF(RC[-4]="","",(SUM(RC[-4]:RC[-1])/R26C9)) -> 
A16: 4 | C16: =IF(R[-8]C="","",R[-8]C) -> subjektives Empfinden | D16: =IF(R[-8]C="","",R[-8]C/R9C4) ->  | E16: =IF(R[-8]C="","",R[-8]C/R9C5) ->  | F16: =IF(R[-8]C="","",R[-8]C6/R9C) ->  | G16: =IF(R[-11]C="","",R[-8]C7/R9C) ->  | H16: =IF(RC[-4]="","",(SUM(RC[-4]:RC[-1])/R26C9)) -> 
C19: CI and CR worksheet
D20: =R[-8]C -> Gewicht | E20: =R[-8]C -> Polsterung | F20: =R[-8]C -> Mit Brille nutzbar | G20: =R[-8]C -> subjektives Empfinden | H20: SUM | I20: SUM/Weight
A21: 1 | B21: Gewicht der Brille | C21: =R[-8]C -> Gewicht | D21: =IF(R[-16]C="","",R[-16]C*R13C8) -> 0.25 | E21: =IF(R[-16]C="","",R[-16]C*R14C8) ->  | F21: =IF(R[-16]C="","",R[-16]C*R15C8) ->  | G21: =IF(R[-16]C="","",R[-16]C*R16C8) ->  | H21: =IF(RC[-4]="","",SUM(RC[-4]:RC[-1])) -> 0.25 | I21: =IF(RC[-1]="","",RC[-1]/R[-8]C8) -> 1
A22: 2 | B22: Wie bequem ist die Polsterung? | C22: =R[-8]C -> Polsterung | D22: =IF(R[-16]C="","",R[-16]C*R13C8) ->  | E22: =IF(R[-17]C="","",R[-16]C*R14C8) ->  | F22: =IF(R[-16]C="","",R[-16]C*R15C8) ->  | G22: =IF(R[-16]C="","",R[-16]C*R16C8) ->  | H22: =IF(RC[-4]="","",SUM(RC[-4]:RC[-1])) ->  | I22: =IF(RC[-1]="","",RC[-1]/R[-8]C8) -> 
A23: 3 | B23: Kann eine Brille unter der VR Brille genutzt werden? | C23: =R[-8]C -> Mit Brille nutzbar | D23: =IF(R[-16]C="","",R[-16]C*R13C8) ->  | E23: =IF(R[-16]C="","",R[-16]C*R14C8) ->  | F23: =IF(R[-18]C="","",R[-16]C*R15C8) ->  | G23: =IF(R[-16]C="","",R[-16]C*R16C8) ->  | H23: =IF(RC[-4]="","",SUM(RC[-4]:RC[-1])) ->  | I23: =IF(RC[-1]="","",RC[-1]/R[-8]C8) -> 
A24: 4 | C24: =R[-8]C -> subjektives Empfinden | D24: =IF(R[-16]C="","",R[-16]C*R13C8) ->  | E24: =IF(R[-16]C="","",R[-16]C*R14C8) ->  | F24: =IF(R[-16]C="","",R[-16]C*R15C8) ->  | G24: =IF(R[-19]C="","",R[-16]C*R16C8) ->  | H24: =IF(RC[-4]="","",SUM(RC[-4]:RC[-1])) ->  | I24: =IF(RC[-1]="","",RC[-1]/R[-8]C8) -> 
H26: count | I26: =COUNTA(R[-21]C[-6]:R[-18]C[-6]) -> 4
H27: lambda max | I27: =(SUM(R[-6]C:R[-3]C))/(COUNT(R[-6]C:R[-3]C)) -> 1
H28: CI | I28: =(R[-1]C-R[-2]C)/(R[-2]C-1) -> -1
H29: CR | I29: =R[-1]C/R[1]C -> -1.1111111111111112
H30: constant | I30: =IF(R[-4]C=R[5]C[-6],R[5]C[-5],IF(R[-4]C=R[6]C[-6],R[6]C[-5],IF(R[-4]C=R[7]C[-6],R[7]C[-5],IF(R[-4]C=R[8]C[-6],R[8]C[-5],IF(R[-4]C=R[9]C[-6],R[9]C[-5],IF(R[-4]C=R[10]C[-6],R[10]C[-5],IF(R[-4]C=R[11]C[-6],R[11]C[-5],IF(R[-4]C=R[12]C[-6],R[12]C[-5],R[13]C[-5])))))))) -> 0.9
C32: Saaty’s CIr values for matrices are given by the following table
C33: Size of Matrix | D33: Random Consistency (CIr)
C34: 1 | D34: 0 | E34: 1
C35: 2 | D35: 0 | E35: 2
C36: 3 | D36: 0.57999999999999996 | E36: 3
C37: 4 | D37: 0.9 | E37: 4
C38: 5 | D38: 1.1200000000000001 | E38: 5
C39: 6 | D39: 1.24 | E39: 6
C40: 7 | D40: 1.32 | E40: 7
C41: 8 | D41: 1.41 | E41: 8
C42: 9 | D42: 1.45 | E42: 9
C43: 10 | D43: 1.49 | E43: 10

Sheet: GewichtungQualitätDerImmersio
C1: CR Value = | D1: =R[34]C[7] -> -0.80645161290322587 | F1: =IF(RC[-2]<0.1,"Reasonable Consistency","Not Consistent") -> Reasonable Consistency
C2: Pairwise comparisons
A3: Item Number | C3: Item Number | D3: 1 | E3: 2 | F3: 3 | G3: 4 | H3: 5 | I3: 7 | M3: ONLY ENTER in the yellow fields
C4: Item Description | D4: =T(R[1]C[-1]) -> Displayauflösung | E4: =T(R[2]C[-2]) -> Qualität der Texturen | F4: =T(R[3]C[-3]) -> Präzession des Trackings | G4: =T(R[4]C[-4]) -> FPS | H4: =T(R[5]C[-5]) -> Sichtfeld | I4: =T(R[6]C[-6]) -> Subjektives Empfinden | M4: Item Descriptions can be text
A5: 1 | C5: Displayauflösung | D5: 1
A6: 2 | B6: Wie aufwändig ist die Grafik der Simulation | C6: Qualität der Texturen | D6: =IF(R[-1]C[1]="","",1/R[-1]C[1]) ->  | E6: 1
A7: 3 | B7: Wie präzise kann die Simulation meinen Kopfbewegungen folgen | C7: Präzession des Trackings | D7: =IF(R[-2]C[2]="","",1/R[-2]C[2]) ->  | E7: =IF(R[-1]C[1]="","",1/R[-1]C[1]) ->  | F7: 1
A8: 4 | B8: Bilder pro Sekunde | C8: FPS | D8: =IF(R[-3]C[3]="","",1/R[-3]C[3]) ->  | E8: =IF(R[-2]C[2]="","",1/R[-2]C[2]) ->  | F8: =IF(R[-1]C[1]="","",1/R[-1]C[1]) ->  | G8: 1
A9: 5 | B9: Welches Sichtfeld bietet die Darstellung durch die Brille | C9: Sichtfeld | D9: =IF(R[-4]C[4]="","",1/R[-4]C[4]) ->  | E9: =IF(R[-3]C[3]="","",1/R[-3]C[3]) ->  | F9: =IF(R[-2]C[2]="","",1/R[-2]C[2]) ->  | G9: =IF(R[-1]C[1]="","",1/R[-1]C[1]) ->  | H9: 1
A10: 7 | C10: Subjektives Empfinden | D10: =IF(R[-5]C[5]="","",1/R[-3]C[4]) ->  | E10: =IF(R[-4]C[4]="","",1/R[-4]C[4]) ->  | F10: =IF(R[-3]C[3]="","",1/R[-3]C[3]) ->  | G10: =IF(R[-2]C[2]="","",1/R[-2]C[2]) ->  | H10: =IF(R[-1]C[1]="","",1/R[-1]C[1]) ->  | I10: 1
A11: 5 | C11: Sum | D11: =IF(R[-6]C="","",SUM(R[-6]C:R[-1]C)) -> 1 | E11: =IF(R[-6]C="","",SUM(R[-6]C:R[-1]C)) ->  | F11: =IF(R[-6]C="","",SUM(R[-6]C:R[-1]C)) ->  | G11: =IF(R[-6]C="","",SUM(R[-6]C:R[-1]C)) ->  | H11: =IF(R[-6]C="","",SUM(R[-6]C:R[-1]C)) ->  | I11: =IF(R[-6]C="","",SUM(R[-6]C:R[-1]C)) -> 
C13: STANDARDIZED MATRIX
D14: =R[-10]C -> Displayauflösung | E14: =R[-10]C -> Qualität der Texturen | F14: =R[-10]C -> Präzession des Trackings | G14: =R[-10]C -> FPS | H14: =R[-10]C -> Sichtfeld | I14: =R[-10]C -> Subjektives Empfinden | J14: Weight
A15: 1 | C15: =IF(R[-10]C="","",R[-10]C) -> Displayauflösung | D15: =IF(R[-10]C="","",R[-10]C/R11C4) -> 1 | E15: =IF(R[-10]C="","",R[-10]C/R11C) ->  | F15: =IF(R[-10]C="","",R[-10]C6/R11C) ->  | G15: =IF(R[-10]C="","",R[-10]C7/R11C) ->  | H15: =IF(R[-10]C="","",R[-10]C8/R11C) ->  | I15: =IF(R[-10]C="","",R[-10]C9/R11C) ->  | J15: =IF(RC[-6]="","",(SUM(RC[-6]:RC[-1])/R32C11)) -> 0.16666666666666666
A16: 2 | B16: Wie aufwändig ist die Grafik der Simulation | C16: =IF(R[-10]C="","",R[-10]C) -> Qualität der Texturen | D16: =IF(R[-10]C="","",R[-10]C/R11C4) ->  | E16: =IF(R[-11]C="","",R[-10]C/R11C5) ->  | F16: =IF(R[-10]C="","",R[-10]C6/R11C) ->  | G16: =IF(R[-10]C="","",R[-10]C7/R11C) ->  | H16: =IF(R[-10]C="","",R[-10]C8/R11C) ->  | I16: =IF(R[-10]C="","",R[-10]C9/R11C) ->  | J16: =IF(RC[-6]="","",(SUM(RC[-6]:RC[-1])/R32C11)) -> 
A17: 3 | B17: Wie präzise kann die Simulation meinen Kopfbewegungen folgen | C17: =IF(R[-10]C="","",R[-10]C) -> Präzession des Trackings | D17: =IF(R[-10]C="","",R[-10]C/R11C4) ->  | E17: =IF(R[-10]C="","",R[-10]C/R11C5) ->  | F17: =IF(R[-12]C="","",R[-10]C6/R11C) ->  | G17: =IF(R[-10]C="","",R[-10]C7/R11C) ->  | H17: =IF(R[-10]C="","",R[-10]C8/R11C) ->  | I17: =IF(R[-10]C="","",R[-10]C9/R11C) ->  | J17: =IF(RC[-6]="","",(SUM(RC[-6]:RC[-1])/R32C11)) -> 
A18: 4 | B18: Bilder pro Sekunde | C18: =IF(R[-10]C="","",R[-10]C) -> FPS | D18: =IF(R[-10]C="","",R[-10]C/R11C4) ->  | E18: =IF(R[-10]C="","",R[-10]C/R11C5) ->  | F18: =IF(R[-10]C="","",R[-10]C6/R11C) ->  | G18: =IF(R[-13]C="","",R[-10]C7/R11C) ->  | H18: =IF(R[-10]C="","",R[-10]C8/R11C) ->  | I18: =IF(R[-10]C="","",R[-10]C9/R11C) ->  | J18: =IF(RC[-6]="","",(SUM(RC[-6]:RC[-1])/R32C11)) -> 
A19: 5 | B19: Welches Sichtfeld bietet die Darstellung durch die Brille | C19: =IF(R[-10]C="","",R[-10]C) -> Sichtfeld | D19: =IF(R[-10]C="","",R[-10]C/R11C4) ->  | E19: =IF(R[-10]C="","",R[-10]C/R11C5) ->  | F19: =IF(R[-10]C="","",R[-10]C6/R11C) ->  | G19: =IF(R[-10]C="","",R[-10]C7/R11C) ->  | H19: =IF(R[-14]C="","",R[-10]C8/R11C) ->  | I19: =IF(R[-10]C="","",R[-10]C9/R11C) ->  | J19: =IF(RC[-6]="","",(SUM(RC[-6]:RC[-1])/R32C11)) -> 
A20: 7 | C20: =IF(R[-10]C="","",R[-10]C) -> Subjektives Empfinden | D20: =IF(R[-10]C="","",R[-10]C/R11C4) ->  | E20: =IF(R[-10]C="","",R[-10]C/R11C5) ->  | F20: =IF(R[-10]C="","",R[-10]C6/R11C) ->  | G20: =IF(R[-10]C="","",R[-10]C7/R11C) ->  | H20: =IF(R[-10]C="","",R[-10]C8/R11C) ->  | I20: =IF(R[-15]C="","",R[-10]C9/R11C) ->  | J20: =IF(RC[-6]="","",(SUM(RC[-6]:RC[-1])/R32C11)) -> 
C23: CI and CR worksheet
D24: =R[-10]C -> Displayauflösung | E24: =R[-10]C -> Qualität der Texturen | F24: =R[-10]C -> Präzession des Trackings | G24: =R[-10]C -> FPS | H24: =R[-10]C -> Sichtfeld | I24: =R[-10]C -> Subjektives Empfinden | J24: SUM | K24: SUM/Weight
A25: 1 | C25: =R[-10]C -> Displayauflösung | D25: =IF(R[-20]C="","",R[-20]C*R15C10) -> 0.16666666666666666 | E25: =IF(R[-20]C="","",R[-20]C*R16C10) ->  | F25: =IF(R[-20]C="","",R[-20]C*R17C10) ->  | G25: =IF(R[-20]C="","",R[-20]C*R18C10) ->  | H25: =IF(R[-20]C="","",R[-20]C*R19C10) ->  | I25: =IF(R[-20]C="","",R[-20]C*R20C10) ->  | J25: =IF(RC[-6]="","",SUM(RC[-6]:RC[-1])) -> 0.16666666666666666 | K25: =IF(RC[-1]="","",RC[-1]/R[-10]C10) -> 1
A26: 2 | B26: Wie aufwändig ist die Grafik der Simulation | C26: =R[-10]C -> Qualität der Texturen | D26: =IF(R[-20]C="","",R[-20]C*R15C10) ->  | E26: =IF(R[-21]C="","",R[-20]C*R16C10) ->  | F26: =IF(R[-20]C="","",R[-20]C*R17C10) ->  | G26: =IF(R[-20]C="","",R[-20]C*R18C10) ->  | H26: =IF(R[-20]C="","",R[-20]C*R19C10) ->  | I26: =IF(R[-20]C="","",R[-20]C*R20C10) ->  | J26: =IF(RC[-6]="","",SUM(RC[-6]:RC[-1])) ->  | K26: =IF(RC[-1]="","",RC[-1]/R[-10]C10) -> 
A27: 3 | B27: Wie präzise kann die Simulation meinen Kopfbewegungen folgen | C27: =R[-10]C -> Präzession des Trackings | D27: =IF(R[-20]C="","",R[-20]C*R15C10) ->  | E27: =IF(R[-20]C="","",R[-20]C*R16C10) ->  | F27: =IF(R[-22]C="","",R[-20]C*R17C10) ->  | G27: =IF(R[-20]C="","",R[-20]C*R18C10) ->  | H27: =IF(R[-20]C="","",R[-20]C*R19C10) ->  | I27: =IF(R[-20]C="","",R[-20]C*R20C10) ->  | J27: =IF(RC[-6]="","",SUM(RC[-6]:RC[-1])) ->  | K27: =IF(RC[-1]="","",RC[-1]/R[-10]C10) -> 
A28: 4 | B28: Bilder pro Sekunde | C28: =R[-10]C -> FPS | D28: =IF(R[-20]C="","",R[-20]C*R15C10) ->  | E28: =IF(R[-20]C="","",R[-20]C*R16C10) ->  | F28: =IF(R[-20]C="","",R[-20]C*R17C10) ->  | G28: =IF(R[-23]C="","",R[-20]C*R18C10) ->  | H28: =IF(R[-20]C="","",R[-20]C*R19C10) ->  | I28: =IF(R[-20]C="","",R[-20]C*R20C10) ->  | J28: =IF(RC[-6]="","",SUM(RC[-6]:RC[-1])) ->  | K28: =IF(RC[-1]="","",RC[-1]/R[-10]C10) -> 
A29: 5 | B29: Welches Sichtfeld bietet die Darstellung durch die Brille | C29: =R[-10]C -> Sichtfeld | D29: =IF(R[-20]C="","",R[-20]C*R15C10) ->  | E29: =IF(R[-20]C="","",R[-20]C*R16C10) ->  | F29: =IF(R[-20]C="","",R[-20]C*R17C10) ->  | G29: =IF(R[-20]C="","",R[-20]C*R18C10) ->  | H29: =IF(R[-24]C="","",R[-20]C*R19C10) ->  | I29: =IF(R[-20]C="","",R[-20]C*R20C10) ->  | J29: =IF(RC[-6]="","",SUM(RC[-6]:RC[-1])) ->  | K29: =IF(RC[-1]="","",RC[-1]/R[-10]C10) -> 
A30: 7 | C30: =R[-10]C -> Subjektives Empfinden | D30: =IF(R[-20]C="","",R[-20]C*R15C10) ->  | E30: =IF(R[-20]C="","",R[-20]C*R16C10) ->  | F30: =IF(R[-20]C="","",R[-20]C*R17C10) ->  | G30: =IF(R[-20]C="","",R[-20]C*R18C10) ->  | H30: =IF(R[-20]C="","",R[-20]C*R19C10) ->  | I30: =IF(R[-25]C="","",R[-20]C*R20C10) ->  | J30: =IF(RC[-6]="","",SUM(RC[-6]:RC[-3])) ->  | K30: =IF(RC[-1]="","",RC[-1]/R[-10]C10) -> 
J32: count | K32: =COUNTA(R[-27]C[-8]:R[-22]C[-8]) -> 6
J33: lambda max | K33: =(SUM(R[-8]C:R[-3]C))/(COUNT(R[-8]C:R[-3]C)) -> 1
J34: CI | K34: =(R[-1]C-R[-2]C)/(R[-2]C-1) -> -1
J35: CR | K35: =R[-1]C/R[1]C -> -0.80645161290322587
J36: constant | K36: =IF(R[-4]C=R[5]C[-8],R[5]C[-7],IF(R[-4]C=R[6]C[-8],R[6]C[-7],IF(R[-4]C=R[7]C[-8],R[7]C[-7],IF(R[-4]C=R[8]C[-8],R[8]C[-7],IF(R[-4]C=R[9]C[-8],R[9]C[-7],IF(R[-4]C=R[10]C[-8],R[10]C[-7],IF(R[-4]C=R[11]C[-8],R[11]C[-7],IF(R[-4]C=R[12]C[-8],R[12]C[-7],R[13]C[-7])))))))) -> 1.24
C38: Saaty’s CIr values for matrices are given by the following table
C39: Size of Matrix | D39: Random Consistency (CIr)
C40: 1 | D40: 0 | E40: 1
C41: 2 | D41: 0 | E41: 2
C42: 3 | D42: 0.57999999999999996 | E42: 3
C43: 4 | D43: 0.9 | E43: 4
C44: 5 | D44: 1.1200000000000001 | E44: 5
C45: 6 | D45: 1.24 | E45: 6
C46: 7 | D46: 1.32 | E46: 7
C47: 8 | D47: 1.41 | E47: 8
C48: 9 | D48: 1.45 | E48: 9
C49: 10 | D49: 1.49 | E49: 10

Sheet: GewichtungBenutzerfreundlichkei
C1: CR Value = | D1: =R[28]C[5] -> -1.1111111111111112 | F1: =IF(RC[-2]<0.1,"Reasonable Consistency","Not Consistent") -> Reasonable Consistency
C2: Pairwise comparisons
A3: Item Number | C3: Item Number | D3: 1 | E3: 2 | F3: 3 | G3: 4 | K3: ONLY ENTER in the yellow fields
C4: Item Description | D4: =T(R[1]C[-1]) -> Inbetriebnahme | E4: =T(R[2]C[-2]) -> Bedienbarkeit | F4: =T(R[3]C[-3]) -> Dokumentation | G4: =T(R[4]C[-4]) -> Subjektives Empfinden | K4: Item Descriptions can be text
A5: 1 | B5: Wie leicht fällt die erste Inbetriebnahme | C5: Inbetriebnahme | D5: 1
A6: 2 | B6: Wie leicht fällt die der Umgang bzw. die Handhabung mit der Brille | C6: Bedienbarkeit | D6: =IF(R[-1]C[1]="","",1/R[-1]C[1]) ->  | E6: 1
A7: 3 | B7: Welche Hilfestellung wird vom Hersteller bereitgestellt | C7: Dokumentation | D7: =IF(R[-2]C[2]="","",1/R[-2]C[2]) ->  | E7: =IF(R[-1]C[1]="","",1/R[-1]C[1]) ->  | F7: 1
A8: 4 | C8: Subjektives Empfinden | D8: =IF(R[-3]C[3]="","",1/R[-3]C[3]) ->  | E8: =IF(R[-2]C[2]="","",1/R[-2]C[2]) ->  | F8: =IF(R[-1]C[1]="","",1/R[-1]C[1]) ->  | G8: 1
A9: 5 | C9: Sum | D9: =IF(R[-4]C="","",SUM(R[-4]C:R[-1]C)) -> 1 | E9: =IF(R[-4]C="","",SUM(R[-4]C:R[-1]C)) ->  | F9: =IF(R[-4]C="","",SUM(R[-4]C:R[-1]C)) ->  | G9: =IF(R[-4]C="","",SUM(R[-4]C:R[-1]C)) -> 
C11: STANDARDIZED MATRIX
D12: =R[-8]C -> Inbetriebnahme | E12: =R[-8]C -> Bedienbarkeit | F12: =R[-8]C -> Dokumentation | G12: =R[-8]C -> Subjektives Empfinden | H12: Weight
A13: 1 | B13: Wie leicht fällt die erste Inbetriebnahme | C13: =IF(R[-8]C="","",R[-8]C) -> Inbetriebnahme | D13: =IF(R[-8]C="","",R[-8]C/R9C4) -> 1 | E13: =IF(R[-8]C="","",R[-8]C/R9C) ->  | F13: =IF(R[-8]C="","",R[-8]C6/R9C) ->  | G13: =IF(R[-8]C="","",R[-8]C7/R9C) ->  | H13: =IF(RC[-4]="","",(SUM(RC[-4]:RC[-1])/R26C9)) -> 0.25
A14: 2 | B14: Wie leicht fällt die der Umgang bzw. die Handhabung mit der Brille | C14: =IF(R[-8]C="","",R[-8]C) -> Bedienbarkeit | D14: =IF(R[-8]C="","",R[-8]C/R9C4) ->  | E14: =IF(R[-9]C="","",R[-8]C/R9C5) ->  | F14: =IF(R[-8]C="","",R[-8]C6/R9C) ->  | G14: =IF(R[-8]C="","",R[-8]C7/R9C) ->  | H14: =IF(RC[-4]="","",(SUM(RC[-4]:RC[-1])/R26C9)) -> 
A15: 3 | B15: Welche Hilfestellung wird vom Hersteller bereitgestellt | C15: =IF(R[-8]C="","",R[-8]C) -> Dokumentation | D15: =IF(R[-8]C="","",R[-8]C/R9C4) ->  | E15: =IF(R[-8]C="","",R[-8]C/R9C5) ->  | F15: =IF(R[-10]C="","",R[-8]C6/R9C) ->  | G15: =IF(R[-8]C="","",R[-8]C7/R9C) ->  | H15: =IF(RC[-4]="","",(SUM(RC[-4]:RC[-1])/R26C9)) -> 
A16: 4 | C16: =IF(R[-8]C="","",R[-8]C) -> Subjektives Empfinden | D16: =IF(R[-8]C="","",R[-8]C/R9C4) ->  | E16: =IF(R[-8]C="","",R[-8]C/R9C5) ->  | F16: =IF(R[-8]C="","",R[-8]C6/R9C) ->  | G16: =IF(R[-11]C="","",R[-8]C7/R9C) ->  | H16: =IF(RC[-4]="","",(SUM(RC[-4]:RC[-1])/R26C9)) -> 
C19: CI and CR worksheet
D20: =R[-8]C -> Inbetriebnahme | E20: =R[-8]C -> Bedienbarkeit | F20: =R[-8]C -> Dokumentation | G20: =R[-8]C -> Subjektives Empfinden | H20: SUM | I20: SUM/Weight
A21: 1 | B21: Wie leicht fällt die erste Inbetriebnahme | C21: =R[-8]C -> Inbetriebnahme | D21: =IF(R[-16]C="","",R[-16]C*R13C8) -> 0.25 | E21: =IF(R[-16]C="","",R[-16]C*R14C8) ->  | F21: =IF(R[-16]C="","",R[-16]C*R15C8) ->  | G21: =IF(R[-16]C="","",R[-16]C*R16C8) ->  | H21: =IF(RC[-4]="","",SUM(RC[-4]:RC[-1])) -> 0.25 | I21: =IF(RC[-1]="","",RC[-1]/R[-8]C8) -> 1
A22: 2 | B22: Wie leicht fällt die der Umgang bzw. die Handhabung mit der Brille | C22: =R[-8]C -> Bedienbarkeit | D22: =IF(R[-16]C="","",R[-16]C*R13C8) ->  | E22: =IF(R[-17]C="","",R[-16]C*R14C8) ->  | F22: =IF(R[-16]C="","",R[-16]C*R15C8) ->  | G22: =IF(R[-16]C="","",R[-16]C*R16C8) ->  | H22: =IF(RC[-4]="","",SUM(RC[-4]:RC[-1])) ->  | I22: =IF(RC[-1]="","",RC[-1]/R[-8]C8) -> 
A23: 3 | B23: Welche Hilfestellung wird vom Hersteller bereitgestellt | C23: =R[-8]C -> Dokumentation | D23: =IF(R[-16]C="","",R[-16]C*R13C8) ->  | E23: =IF(R[-16]C="","",R[-16]C*R14C8) ->  | F23: =IF(R[-18]C="","",R[-16]C*R15C8) ->  | G23: =IF(R[-16]C="","",R[-16]C*R16C8) ->  | H23: =IF(RC[-4]="","",SUM(RC[-4]:RC[-1])) ->  | I23: =IF(RC[-1]="","",RC[-1]/R[-8]C8) -> 
A24: 4 | C24: =R[-8]C -> Subjektives Empfinden | D24: =IF(R[-16]C="","",R[-16]C*R13C8) ->  | E24: =IF(R[-16]C="","",R[-16]C*R14C8) ->  | F24: =IF(R[-16]C="","",R[-16]C*R15C8) ->  | G24: =IF(R[-19]C="","",R[-16]C*R16C8) ->  | H24: =IF(RC[-4]="","",SUM(RC[-4]:RC[-1])) ->  | I24: =IF(RC[-1]="","",RC[-1]/R[-8]C8) -> 
H26: count | I26: =COUNTA(R[-21]C[-6]:R[-18]C[-6]) -> 4
H27: lambda max | I27: =(SUM(R[-6]C:R[-3]C))/(COUNT(R[-6]C:R[-3]C)) -> 1
H28: CI | I28: =(R[-1]C-R[-2]C)/(R[-2]C-1) -> -1
H29: CR | I29: =R[-1]C/R[1]C -> -1.1111111111111112
H30: constant | I30: =IF(R[-4]C=R[5]C[-6],R[5]C[-5],IF(R[-4]C=R[6]C[-6],R[6]C[-5],IF(R[-4]C=R[7]C[-6],R[7]C[-5],IF(R[-4]C=R[8]C[-6],R[8]C[-5],IF(R[-4]C=R[9]C[-6],R[9]C[-5],IF(R[-4]C=R[10]C[-6],R[10]C[-5],IF(R[-4]C=R[11]C[-6],R[11]C[-5],IF(R[-4]C=R[12]C[-6],R[12]C[-5],R[13]C[-5])))))))) -> 0.9
C32: Saaty’s CIr values for matrices are given by the following table
C33: Size of Matrix | D33: Random Consistency (CIr)
C34: 1 | D34: 0 | E34: 1
C35: 2 | D35: 0 | E35: 2
C36: 3 | D36: 0.57999999999999996 | E36: 3
C37: 4 | D37: 0.9 | E37: 4
C38: 5 | D38: 1.1200000000000001 | E38: 5
C39: 6 | D39: 1.24 | E39: 6
C40: 7 | D40: 1.32 | E40: 7
C41: 8 | D41: 1.41 | E41: 8
C42: 9 | D42: 1.45 | E42: 9
C43: 10 | D43: 1.49 | E43: 10

Sheet: Gewichtung Gesamt
C1: CR Value = | D1: =R[44]C[10] -> -0.76628352490421459 | F1: =IF(RC[-2]<0.1,"Reasonable Consistency","Not Consistent") -> Reasonable Consistency
C2: Pairwise comparisons
A3: Item Number | C3: Item Number | D3: 1 | E3: 2 | F3: 3 | G3: 4 | H3: 5 | I3: 7 | J3: 8 | K3: 9 | L3: 10 | M3: 11 | P3: ONLY ENTER in the yellow fields
C4: Item Description | D4: =T(R[1]C[-1]) -> Kosten | E4: =T(R[2]C[-2]) -> Robustheit | F4: =T(R[3]C[-3]) -> Tragekomfort | G4: =T(R[4]C[-4]) -> Qualität der Immersion | H4: =T(R[5]C[-5]) -> Bedienbarkeit/Benutzerfreundlichkeit | I4: =T(R[6]C[-6]) -> Mobilität des Systems | J4: =T(R[7]C[-7]) -> Open Source Software | K4: =T(R[8]C[-8]) -> Open Hardware | L4: =T(R[9]C[-9]) -> Verfügbare Software | M4: =T(R[10]C[-10]) -> Entwicklung für diese Plattform | P4: Item Descriptions can be text
A5: 1 | B5: Anschaffung als auch evtl. laufende Kosten | C5: Kosten | D5: 1
A6: 2 | B6: Langlebigkeit der Brille | C6: Robustheit | D6: =IF(R[-1]C[1]="","",1/R[-1]C[1]) ->  | E6: 1
A7: 3 | B7: siehe Unterkriterien | C7: Tragekomfort | D7: =IF(R[-2]C[2]="","",1/R[-2]C[2]) ->  | E7: =IF(R[-1]C[1]="","",1/R[-1]C[1]) ->  | F7: 1
A8: 4 | B8: siehe Unterkriterien | C8: Qualität der Immersion | D8: =IF(R[-3]C[3]="","",1/R[-3]C[3]) ->  | E8: =IF(R[-2]C[2]="","",1/R[-2]C[2]) ->  | F8: =IF(R[-1]C[1]="","",1/R[-1]C[1]) ->  | G8: 1
A9: 5 | B9: siehe Unterkriterien | C9: Bedienbarkeit/Benutzerfreundlichkeit | D9: =IF(R[-4]C[4]="","",1/R[-4]C[4]) ->  | E9: =IF(R[-3]C[3]="","",1/R[-3]C[3]) ->  | F9: =IF(R[-2]C[2]="","",1/R[-2]C[2]) ->  | G9: =IF(R[-1]C[1]="","",1/R[-1]C[1]) ->  | H9: 1
A10: 7 | B10: Ist ein PC nötig? Wird die Bewegungsfreiheit durch Kabel eingeschränkt? | C10: Mobilität des Systems | D10: =IF(R[-5]C[5]="","",1/R[-5]C[5]) ->  | E10: =IF(R[-4]C[4]="","",1/R[-4]C[4]) ->  | F10: =IF(R[-3]C[3]="","",1/R[-3]C[3]) ->  | G10: =IF(R[-2]C[2]="","",1/R[-2]C[2]) ->  | H10: =IF(R[-1]C[1]="","",1/R[-1]C[1]) ->  | I10: 1
A11: 8 | B11: Ist der Software Code öffentlich zugänglich? | C11: Open Source Software | D11: =IF(R[-6]C[6]="","",1/R[-6]C[6]) ->  | E11: =IF(R[-5]C[5]="","",1/R[-5]C[5]) ->  | F11: =IF(R[-4]C[4]="","",1/R[-4]C[4]) ->  | G11: =IF(R[-3]C[3]="","",1/R[-3]C[3]) ->  | H11: =IF(R[-2]C[2]="","",1/R[-2]C[2]) ->  | I11: =IF(R[-1]C[1]="","",1/R[-1]C[1]) ->  | J11: 1
A12: 9 | B12: Werden die verwendeten, technischen Komponenten vom Hersteller offgelegt? | C12: Open Hardware | D12: =IF(R[-7]C[7]="","",1/R[-7]C[7]) ->  | E12: =IF(R[-6]C[6]="","",1/R[-6]C[6]) ->  | F12: =IF(R[-5]C[5]="","",1/R[-5]C[5]) ->  | G12: =IF(R[-4]C[4]="","",1/R[-4]C[4]) ->  | H12: =IF(R[-3]C[3]="","",1/R[-3]C[3]) ->  | I12: =IF(R[-2]C[2]="","",1/R[-2]C[2]) ->  | J12: =IF(R[-1]C[1]="","",1/R[-1]C[1]) ->  | K12: 1
A13: 10 | B13: Anzahl und Art | C13: Verfügbare Software | D13: =IF(R[-8]C[8]="","",1/R[-8]C[8]) ->  | E13: =IF(R[-7]C[7]="","",1/R[-7]C[7]) ->  | F13: =IF(R[-6]C[6]="","",1/R[-6]C[6]) ->  | G13: =IF(R[-5]C[5]="","",1/R[-5]C[5]) ->  | H13: =IF(R[-4]C[4]="","",1/R[-4]C[4]) ->  | I13: =IF(R[-3]C[3]="","",1/R[-3]C[3]) ->  | J13: =IF(R[-2]C[2]="","",1/R[-2]C[2]) ->  | K13: =IF(R[-1]C[1]="","",1/R[-1]C[1]) ->  | L13: 1
A14: 11 | B14: Wie leicht ist eine native Entwicklung möglich? | C14: Entwicklung für diese Plattform | D14: =IF(R[-9]C[9]="","",1/R[-9]C[9]) ->  | E14: =IF(R[-8]C[8]="","",1/R[-8]C[8]) ->  | F14: =IF(R[-7]C[7]="","",1/R[-7]C[7]) ->  | G14: =IF(R[-6]C[6]="","",1/R[-6]C[6]) ->  | H14: =IF(R[-5]C[5]="","",1/R[-5]C[5]) ->  | I14: =IF(R[-4]C[4]="","",1/R[-4]C[4]) ->  | J14: =IF(R[-3]C[3]="","",1/R[-3]C[3]) ->  | K14: =IF(R[-2]C[2]="","",1/R[-2]C[2]) ->  | L14: =IF(R[-1]C[1]="","",1/R[-1]C[1]) ->  | M14: 1
A15: 5 | C15: Sum | D15: =IF(R[-10]C="","",SUM(R[-10]C:R[-1]C)) -> 1 | E15: =IF(R[-10]C="","",SUM(R[-10]C:R[-1]C)) ->  | F15: =IF(R[-10]C="","",SUM(R[-10]C:R[-1]C)) ->  | G15: =IF(R[-10]C="","",SUM(R[-10]C:R[-1]C)) ->  | H15: =IF(R[-10]C="","",SUM(R[-10]C:R[-1]C)) ->  | I15: =IF(R[-10]C="","",SUM(R[-10]C:R[-1]C)) ->  | J15: =IF(R[-10]C="","",SUM(R[-10]C:R[-1]C)) ->  | K15: =IF(R[-10]C="","",SUM(R[-10]C:R[-1]C)) ->  | L15: =IF(R[-10]C="","",SUM(R[-10]C:R[-1]C)) ->  | M15: =IF(R[-10]C="","",SUM(R[-10]C:R[-1]C)) -> 
C17: STANDARDIZED MATRIX
D18: =R[-14]C -> Kosten | E18: =R[-14]C -> Robustheit | F18: =R[-14]C -> Tragekomfort | G18: =R[-14]C -> Qualität der Immersion | H18: =R[-14]C -> Bedienbarkeit/Benutzerfreundlichkeit | I18: =R[-14]C -> Mobilität des Systems | J18: =R[-14]C -> Open Source Software | K18: =R[-14]C -> Open Hardware | L18: =R[-14]C -> Verfügbare Software | M18: =R[-14]C -> Entwicklung für diese Plattform | N18: Weight
A19: 1 | B19: Anschaffung als auch evtl. laufende Kosten | C19: =IF(R[-14]C="","",R[-14]C) -> Kosten | D19: =IF(R[-14]C="","",R[-14]C/R15C4) -> 1 | E19: =IF(R[-14]C="","",R[-14]C/R15C) ->  | F19: =IF(R[-14]C="","",R[-14]C6/R15C) ->  | G19: =IF(R[-14]C="","",R[-14]C7/R15C) ->  | H19: =IF(R[-14]C="","",R[-14]C8/R15C) ->  | I19: =IF(R[-14]C="","",R[-14]C9/R15C) ->  | J19: =IF(R[-14]C="","",R[-14]C10/R15C) ->  | K19: =IF(R[-14]C="","",R[-14]C11/R15C) ->  | L19: =IF(R[-14]C="","",R[-14]C12/R15C) ->  | M19: =IF(R[-14]C="","",R[-14]C13/R15C) ->  | N19: =IF(RC[-10]="","",(SUM(RC[-10]:RC[-1])/R42C14)) -> 0.1111111111111111
A20: 2 | B20: Langlebigkeit der Brille | C20: =IF(R[-14]C="","",R[-14]C) -> Robustheit | D20: =IF(R[-14]C="","",R[-14]C/R15C4) ->  | E20: =IF(R[-15]C="","",R[-14]C/R15C5) ->  | F20: =IF(R[-14]C="","",R[-14]C6/R15C) ->  | G20: =IF(R[-14]C="","",R[-14]C7/R15C) ->  | H20: =IF(R[-14]C="","",R[-14]C8/R15C) ->  | I20: =IF(R[-14]C="","",R[-14]C9/R15C) ->  | J20: =IF(R[-14]C="","",R[-14]C10/R15C) ->  | K20: =IF(R[-14]C="","",R[-14]C11/R15C) ->  | L20: =IF(R[-14]C="","",R[-14]C12/R15C) ->  | M20: =IF(R[-14]C="","",R[-14]C13/R15C) ->  | N20: =IF(RC[-10]="","",(SUM(RC[-10]:RC[-1])/R42C14)) -> 
A21: 3 | B21: siehe Unterkriterien | C21: =IF(R[-14]C="","",R[-14]C) -> Tragekomfort | D21: =IF(R[-14]C="","",R[-14]C/R15C4) ->  | E21: =IF(R[-14]C="","",R[-14]C/R15C5) ->  | F21: =IF(R[-16]C="","",R[-14]C6/R15C) ->  | G21: =IF(R[-14]C="","",R[-14]C7/R15C) ->  | H21: =IF(R[-14]C="","",R[-14]C8/R15C) ->  | I21: =IF(R[-14]C="","",R[-14]C9/R15C) ->  | J21: =IF(R[-14]C="","",R[-14]C10/R15C) ->  | K21: =IF(R[-14]C="","",R[-14]C11/R15C) ->  | L21: =IF(R[-14]C="","",R[-14]C12/R15C) ->  | M21: =IF(R[-14]C="","",R[-14]C13/R15C) ->  | N21: =IF(RC[-10]="","",(SUM(RC[-10]:RC[-1])/R42C14)) -> 
A22: 4 | B22: siehe Unterkriterien | C22: =IF(R[-14]C="","",R[-14]C) -> Qualität der Immersion | D22: =IF(R[-14]C="","",R[-14]C/R15C4) ->  | E22: =IF(R[-14]C="","",R[-14]C/R15C5) ->  | F22: =IF(R[-14]C="","",R[-14]C6/R15C) ->  | G22: =IF(R[-17]C="","",R[-14]C7/R15C) ->  | H22: =IF(R[-14]C="","",R[-14]C8/R15C) ->  | I22: =IF(R[-14]C="","",R[-14]C9/R15C) ->  | J22: =IF(R[-14]C="","",R[-14]C10/R15C) ->  | K22: =IF(R[-14]C="","",R[-14]C11/R15C) ->  | L22: =IF(R[-14]C="","",R[-14]C12/R15C) ->  | M22: =IF(R[-14]C="","",R[-14]C13/R15C) ->  | N22: =IF(RC[-10]="","",(SUM(RC[-10]:RC[-1])/R42C14)) -> 
A23: 5 | B23: siehe Unterkriterien | C23: =IF(R[-14]C="","",R[-14]C) -> Bedienbarkeit/Benutzerfreundlichkeit | D23: =IF(R[-14]C="","",R[-14]C/R15C4) ->  | E23: =IF(R[-14]C="","",R[-14]C/R15C5) ->  | F23: =IF(R[-14]C="","",R[-14]C6/R15C) ->  | G23: =IF(R[-14]C="","",R[-14]C7/R15C) ->  | H23: =IF(R[-18]C="","",R[-14]C8/R15C) ->  | I23: =IF(R[-14]C="","",R[-14]C9/R15C) ->  | J23: =IF(R[-14]C="","",R[-14]C10/R15C) ->  | K23: =IF(R[-14]C="","",R[-14]C11/R15C) ->  | L23: =IF(R[-14]C="","",R[-14]C12/R15C) ->  | M23: =IF(R[-14]C="","",R[-14]C13/R15C) ->  | N23: =IF(RC[-10]="","",(SUM(RC[-10]:RC[-1])/R42C14)) -> 
A24: 7 | B24: Ist ein PC nötig? Wird die Bewegungsfreiheit durch Kabel eingeschränkt? | C24: =IF(R[-14]C="","",R[-14]C) -> Mobilität des Systems | D24: =IF(R[-14]C="","",R[-14]C/R15C4) ->  | E24: =IF(R[-14]C="","",R[-14]C/R15C5) ->  | F24: =IF(R[-14]C="","",R[-14]C6/R15C) ->  | G24: =IF(R[-14]C="","",R[-14]C7/R15C) ->  | H24: =IF(R[-14]C="","",R[-14]C8/R15C) ->  | I24: =IF(R[-19]C="","",R[-14]C9/R15C) ->  | J24: =IF(R[-14]C="","",R[-14]C10/R15C) ->  | K24: =IF(R[-14]C="","",R[-14]C11/R15C) ->  | L24: =IF(R[-14]C="","",R[-14]C12/R15C) ->  | M24: =IF(R[-14]C="","",R[-14]C13/R15C) ->  | N24: =IF(RC[-10]="","",(SUM(RC[-10]:RC[-1])/R42C14)) -> 
A25: 8 | B25: Ist der Software Code öffentlich zugänglich? | C25: =IF(R[-14]C="","",R[-14]C) -> Open Source Software | D25: =IF(R[-14]C="","",R[-14]C/R15C4) ->  | E25: =IF(R[-14]C="","",R[-14]C/R15C5) ->  | F25: =IF(R[-14]C="","",R[-14]C6/R15C) ->  | G25: =IF(R[-14]C="","",R[-14]C7/R15C) ->  | H25: =IF(R[-14]C="","",R[-14]C8/R15C) ->  | I25: =IF(R[-14]C="","",R[-14]C9/R15C) ->  | J25: =IF(R[-20]C="","",R[-14]C10/R15C) ->  | K25: =IF(R[-14]C="","",R[-14]C11/R15C) ->  | L25: =IF(R[-14]C="","",R[-14]C12/R15C) ->  | M25: =IF(R[-14]C="","",R[-14]C13/R15C) ->  | N25: =IF(RC[-10]="","",(SUM(RC[-10]:RC[-1])/R42C14)) -> 
A26: 9 | B26: Werden die verwendeten, technischen Komponenten vom Hersteller offgelegt? | C26: =IF(R[-14]C="","",R[-14]C) -> Open Hardware | D26: =IF(R[-14]C="","",R[-14]C/R15C4) ->  | E26: =IF(R[-14]C="","",R[-14]C/R15C5) ->  | F26: =IF(R[-14]C="","",R[-14]C6/R15C) ->  | G26: =IF(R[-14]C="","",R[-14]C7/R15C) ->  | H26: =IF(R[-14]C="","",R[-14]C8/R15C) ->  | I26: =IF(R[-14]C="","",R[-14]C9/R15C) ->  | J26: =IF(R[-14]C="","",R[-14]C10/R15C) ->  | K26: =IF(R[-21]C="","",R[-14]C11/R15C) ->  | L26: =IF(R[-14]C="","",R[-14]C12/R15C) ->  | M26: =IF(R[-14]C="","",R[-14]C13/R15C) ->  | N26: =IF(RC[-10]="","",(SUM(RC[-10]:RC[-1])/R42C14)) -> 
A27: 10 | B27: Anzahl und Art | C27: =IF(R[-14]C="","",R[-14]C) -> Verfügbare Software | D27: =IF(R[-14]C="","",R[-14]C/R15C4) ->  | E27: =IF(R[-14]C="","",R[-14]C/R15C5) ->  | F27: =IF(R[-14]C="","",R[-14]C6/R15C) ->  | G27: =IF(R[-14]C="","",R[-14]C7/R15C) ->  | H27: =IF(R[-14]C="","",R[-14]C8/R15C) ->  | I27: =IF(R[-14]C="","",R[-14]C9/R15C) ->  | J27: =IF(R[-14]C="","",R[-14]C10/R15C) ->  | K27: =IF(R[-14]C="","",R[-14]C11/R15C) ->  | L27: =IF(R[-22]C="","",R[-14]C12/R15C) ->  | M27: =IF(R[-14]C="","",R[-14]C13/R15C) ->  | N27: =IF(RC[-10]="","",(SUM(RC[-10]:RC[-1])/R42C14)) -> 
A28: 11 | B28: Wie leicht ist eine native Entwicklung möglich? | C28: =IF(R[-14]C="","",R[-14]C) -> Entwicklung für diese Plattform | D28: =IF(R[-14]C="","",R[-14]C/R15C4) ->  | E28: =IF(R[-14]C="","",R[-14]C/R15C5) ->  | F28: =IF(R[-14]C="","",R[-14]C6/R15C) ->  | G28: =IF(R[-14]C="","",R[-14]C7/R15C) ->  | H28: =IF(R[-14]C="","",R[-14]C8/R15C) ->  | I28: =IF(R[-14]C="","",R[-14]C9/R15C) ->  | J28: =IF(R[-14]C="","",R[-14]C10/R15C) ->  | K28: =IF(R[-14]C="","",R[-14]C11/R15C) ->  | L28: =IF(R[-22]C="","",R[-14]C12/R15C) ->  | M28: =IF(R[-14]C="","",R[-14]C13/R15C) -> #VALUE! | N28: =IF(RC[-10]="","",(SUM(RC[-10]:RC[-1])/R42C14)) -> 
C30: CI and CR worksheet
D31: =R[-13]C -> Kosten | E31: =R[-13]C -> Robustheit | F31: =R[-13]C -> Tragekomfort | G31: =R[-13]C -> Qualität der Immersion | H31: =R[-13]C -> Bedienbarkeit/Benutzerfreundlichkeit | I31: =R[-13]C -> Mobilität des Systems | J31: =R[-13]C -> Open Source Software | K31: =R[-13]C -> Open Hardware | L31: =R[-13]C -> Verfügbare Software | M31: =R[-13]C -> Entwicklung für diese Plattform | N31: SUM | O31: SUM/Weight
A32: 1 | B32: Anschaffung als auch evtl. laufende Kosten | C32: =R[-13]C -> Kosten | D32: =IF(R[-27]C="","",R[-27]C*R19C14) -> 0.1111111111111111 | E32: =IF(R[-27]C="","",R[-27]C*R20C14) ->  | F32: =IF(R[-27]C="","",R[-27]C*R21C14) ->  | G32: =IF(R[-27]C="","",R[-27]C*R22C14) ->  | H32: =IF(R[-27]C="","",R[-27]C*R23C14) ->  | I32: =IF(R[-27]C="","",R[-27]C*R24C14) ->  | J32: =IF(R[-27]C="","",R[-27]C*R25C14) ->  | K32: =IF(R[-27]C="","",R[-27]C*R26C14) ->  | L32: =IF(R[-27]C="","",R[-27]C*R27C14) ->  | M32: =IF(R[-27]C="","",R[-27]C*R28C14) ->  | N32: =IF(RC[-10]="","",SUM(RC[-10]:RC[-1])) -> 0.1111111111111111 | O32: =IF(RC[-1]="","",RC[-1]/R[-13]C14) -> 1
A33: 2 | B33: Langlebigkeit der Brille | C33: =R[-13]C -> Robustheit | D33: =IF(R[-27]C="","",R[-27]C*R19C14) ->  | E33: =IF(R[-28]C="","",R[-27]C*R20C14) ->  | F33: =IF(R[-27]C="","",R[-27]C*R21C14) ->  | G33: =IF(R[-27]C="","",R[-27]C*R22C14) ->  | H33: =IF(R[-27]C="","",R[-27]C*R23C14) ->  | I33: =IF(R[-27]C="","",R[-27]C*R24C14) ->  | J33: =IF(R[-27]C="","",R[-27]C*R25C14) ->  | K33: =IF(R[-27]C="","",R[-27]C*R26C14) ->  | L33: =IF(R[-27]C="","",R[-27]C*R27C14) ->  | M33: =IF(R[-27]C="","",R[-27]C*R28C14) ->  | N33: =IF(RC[-10]="","",SUM(RC[-10]:RC[-1])) ->  | O33: =IF(RC[-1]="","",RC[-1]/R[-13]C14) -> 
A34: 3 | B34: siehe Unterkriterien | C34: =R[-13]C -> Tragekomfort | D34: =IF(R[-27]C="","",R[-27]C*R19C14) ->  | E34: =IF(R[-27]C="","",R[-27]C*R20C14) ->  | F34: =IF(R[-27]C="","",R[-27]C*R21C14) -> #VALUE! | G34: =IF(R[-27]C="","",R[-27]C*R22C14) ->  | H34: =IF(R[-27]C="","",R[-27]C*R23C14) ->  | I34: =IF(R[-27]C="","",R[-27]C*R24C14) ->  | J34: =IF(R[-27]C="","",R[-27]C*R25C14) ->  | K34: =IF(R[-27]C="","",R[-27]C*R26C14) ->  | L34: =IF(R[-27]C="","",R[-27]C*R27C14) ->  | M34: =IF(R[-27]C="","",R[-27]C*R28C14) ->  | N34: =IF(RC[-10]="","",SUM(RC[-10]:RC[-1])) ->  | O34: =IF(RC[-1]="","",RC[-1]/R[-13]C14) -> 
A35: 4 | B35: siehe Unterkriterien | C35: =R[-13]C -> Qualität der Immersion | D35: =IF(R[-27]C="","",R[-27]C*R19C14) ->  | E35: =IF(R[-28]C="","",R[-27]C*R20C14) ->  | F35: =IF(R[-27]C="","",R[-27]C*R21C14) ->  | G35: =IF(R[-27]C="","",R[-27]C*R22C14) -> #VALUE! | H35: =IF(R[-27]C="","",R[-27]C*R23C14) ->  | I35: =IF(R[-27]C="","",R[-27]C*R24C14) ->  | J35: =IF(R[-27]C="","",R[-27]C*R25C14) ->  | K35: =IF(R[-27]C="","",R[-27]C*R26C14) ->  | L35: =IF(R[-27]C="","",R[-27]C*R27C14) ->  | M35: =IF(R[-27]C="","",R[-27]C*R28C14) ->  | N35: =IF(RC[-10]="","",SUM(RC[-10]:RC[-1])) ->  | O35: =IF(RC[-1]="","",RC[-1]/R[-13]C14) -> 
A36: 5 | B36: siehe Unterkriterien | C36: =R[-13]C -> Bedienbarkeit/Benutzerfreundlichkeit | D36: =IF(R[-27]C="","",R[-27]C*R19C14) ->  | E36: =IF(R[-27]C="","",R[-27]C*R20C14) ->  | F36: =IF(R[-27]C="","",R[-27]C*R21C14) ->  | G36: =IF(R[-27]C="","",R[-27]C*R22C14) ->  | H36: =IF(R[-27]C="","",R[-27]C*R23C14) -> #VALUE! | I36: =IF(R[-27]C="","",R[-27]C*R24C14) ->  | J36: =IF(R[-27]C="","",R[-27]C*R25C14) ->  | K36: =IF(R[-27]C="","",R[-27]C*R26C14) ->  | L36: =IF(R[-27]C="","",R[-27]C*R27C14) ->  | M36: =IF(R[-27]C="","",R[-27]C*R28C14) ->  | N36: =IF(RC[-10]="","",SUM(RC[-10]:RC[-1])) ->  | O36: =IF(RC[-1]="","",RC[-1]/R[-13]C14) -> 
A37: 7 | B37: Ist ein PC nötig? Wird die Bewegungsfreiheit durch Kabel eingeschränkt? | C37: =R[-13]C -> Mobilität des Systems | D37: =IF(R[-27]C="","",R[-27]C*R19C14) ->  | E37: =IF(R[-27]C="","",R[-27]C*R20C14) ->  | F37: =IF(R[-27]C="","",R[-27]C*R21C14) ->  | G37: =IF(R[-27]C="","",R[-27]C*R22C14) ->  | H37: =IF(R[-27]C="","",R[-27]C*R23C14) ->  | I37: =IF(R[-27]C="","",R[-27]C*R24C14) -> #VALUE! | J37: =IF(R[-27]C="","",R[-27]C*R25C14) ->  | K37: =IF(R[-27]C="","",R[-27]C*R26C14) ->  | L37: =IF(R[-27]C="","",R[-27]C*R27C14) ->  | M37: =IF(R[-27]C="","",R[-27]C*R28C14) ->  | N37: =IF(RC[-10]="","",SUM(RC[-10]:RC[-1])) ->  | O37: =IF(RC[-1]="","",RC[-1]/R[-13]C14) -> 
A38: 8 | B38: Ist der Software Code öffentlich zugänglich? | C38: =R[-13]C -> Open Source Software | D38: =IF(R[-27]C="","",R[-27]C*R19C14) ->  | E38: =IF(R[-28]C="","",R[-27]C*R20C14) ->  | F38: =IF(R[-27]C="","",R[-27]C*R21C14) ->  | G38: =IF(R[-27]C="","",R[-27]C*R22C14) ->  | H38: =IF(R[-27]C="","",R[-27]C*R23C14) ->  | I38: =IF(R[-27]C="","",R[-27]C*R24C14) ->  | J38: =IF(R[-27]C="","",R[-27]C*R25C14) -> #VALUE! | K38: =IF(R[-27]C="","",R[-27]C*R26C14) ->  | L38: =IF(R[-27]C="","",R[-27]C*R27C14) ->  | M38: =IF(R[-27]C="","",R[-27]C*R28C14) ->  | N38: =IF(RC[-10]="","",SUM(RC[-10]:RC[-1])) ->  | O38: =IF(RC[-1]="","",RC[-1]/R[-13]C14) -> 
A39: 9 | B39: Werden die verwendeten, technischen Komponenten vom Hersteller offgelegt? | C39: =R[-13]C -> Open Hardware | D39: =IF(R[-27]C="","",R[-27]C*R19C14) ->  | E39: =IF(R[-27]C="","",R[-27]C*R20C14) ->  | F39: =IF(R[-27]C="","",R[-27]C*R21C14) ->  | G39: =IF(R[-27]C="","",R[-27]C*R22C14) ->  | H39: =IF(R[-27]C="","",R[-27]C*R23C14) ->  | I39: =IF(R[-27]C="","",R[-27]C*R24C14) ->  | J39: =IF(R[-27]C="","",R[-27]C*R25C14) ->  | K39: =IF(R[-27]C="","",R[-27]C*R26C14) -> #VALUE! | L39: =IF(R[-27]C="","",R[-27]C*R27C14) ->  | M39: =IF(R[-27]C="","",R[-27]C*R28C14) ->  | N39: =IF(RC[-10]="","",SUM(RC[-10]:RC[-1])) ->  | O39: =IF(RC[-1]="","",RC[-1]/R[-13]C14) -> 
A40: 10 | B40: Anzahl und Art | C40: =R[-13]C -> Verfügbare Software | D40: =IF(R[-27]C="","",R[-27]C*R19C14) ->  | E40: =IF(R[-28]C="","",R[-27]C*R20C14) ->  | F40: =IF(R[-27]C="","",R[-27]C*R21C14) ->  | G40: =IF(R[-27]C="","",R[-27]C*R22C14) ->  | H40: =IF(R[-27]C="","",R[-27]C*R23C14) ->  | I40: =IF(R[-27]C="","",R[-27]C*R24C14) ->  | J40: =IF(R[-27]C="","",R[-27]C*R25C14) ->  | K40: =IF(R[-27]C="","",R[-27]C*R26C14) ->  | L40: =IF(R[-27]C="","",R[-27]C*R27C14) -> #VALUE! | M40: =IF(R[-27]C="","",R[-27]C*R28C14) ->  | N40: =IF(RC[-10]="","",SUM(RC[-10]:RC[-1])) ->  | O40: =IF(RC[-1]="","",RC[-1]/R[-13]C14) -> 
A41: 11 | B41: Wie leicht ist eine native Entwicklung möglich? | C41: =R[-13]C -> Entwicklung für diese Plattform | D41: =IF(R[-27]C="","",R[-27]C*R19C14) ->  | E41: =IF(R[-27]C="","",R[-27]C*R20C14) ->  | F41: =IF(R[-27]C="","",R[-27]C*R21C14) ->  | G41: =IF(R[-27]C="","",R[-27]C*R22C14) ->  | H41: =IF(R[-27]C="","",R[-27]C*R23C14) ->  | I41: =IF(R[-27]C="","",R[-27]C*R24C14) ->  | J41: =IF(R[-27]C="","",R[-27]C*R25C14) ->  | K41: =IF(R[-27]C="","",R[-27]C*R26C14) ->  | L41: =IF(R[-27]C="","",R[-27]C*R27C14) ->  | M41: =IF(R[-27]C="","",R[-27]C*R28C14) -> #VALUE! | N41: =IF(RC[-10]="","",SUM(RC[-10]:RC[-1])) ->  | O41: =IF(RC[-1]="","",RC[-1]/R[-13]C14) -> 
M42: count | N42: =COUNTA(R[-37]C[-11]:R[-29]C[-11]) -> 9
M43: lambda max | N43: =(SUM(R[-11]C:R[-3]C))/(COUNT(R[-11]C:R[-3]C)) -> 0.1111111111111111
M44: CI | N44: =(R[-1]C-R[-2]C)/(R[-2]C-1) -> -1.1111111111111112
M45: CR | N45: =R[-1]C/R[1]C -> -0.76628352490421459
M46: constant | N46: =IF(R[-4]C=R[5]C[-11],R[5]C[-10],IF(R[-4]C=R[6]C[-11],R[6]C[-10],IF(R[-4]C=R[7]C[-11],R[7]C[-10],IF(R[-4]C=R[8]C[-11],R[8]C[-10],IF(R[-4]C=R[9]C[-11],R[9]C[-10],IF(R[-4]C=R[10]C[-11],R[10]C[-10],IF(R[-4]C=R[11]C[-11],R[11]C[-10],IF(R[-4]C=R[12]C[-11],R[12]C[-10],R[13]C[-10])))))))) -> 1.45
C48: Saaty’s CIr values for matrices are given by the following table
C49: Size of Matrix | D49: Random Consistency (CIr)
C50: 1 | D50: 0 | E50: 1
C51: 2 | D51: 0 | E51: 2
C52: 3 | D52: 0.57999999999999996 | E52: 3
C53: 4 | D53: 0.9 | E53: 4
C54: 5 | D54: 1.1200000000000001 | E54: 5
C55: 6 | D55: 1.24 | E55: 6
C56: 7 | D56: 1.32 | E56: 7
C57: 8 | D57: 1.41 | E57: 8
C58: 9 | D58: 1.45 | E58: 9
C59: 10 | D59: 1.49 | E59: 10